{
  "schema": "csm-review-findings/1",
  "schemaRevision": 1,
  "artifact": {
    "artifactId": "art-review-orchestrate-20260830t120000z",
    "owner": "csm-review",
    "runId": "run-20260830t120000z-orchestrate-review",
    "digest": "sha256:0000000000000000000000000000000000000000000000000000000000000000",
    "createdAt": "2026-08-30T12:00:00Z",
    "terminal": true
  },
  "source": { "commitSha": "75adabe", "repository": "opencode-skills" },
  "findings": [
    {
      "id": "F-002",
      "title": "The shipped CLI host defaults sibling execution to a new OpenCode session",
      "dimension": "architecture",
      "category": "unwanted-runtime-coupling",
      "anchorRef": "ISO/IEC 25010:2023 maintainability",
      "severity": "high",
      "confidence": "high",
      "evidenceClass": "E2",
      "locations": [{ "path": "csm-orchestrate/lib/cli-host.mjs", "line": 53, "symbol": "createCliHost" }, { "path": "csm-orchestrate/lib/cli-host.mjs", "line": 84, "symbol": "invokeSiblingSkill" }],
      "quotedSnippets": ["command = \"opencode\"", "[\"run\", \"--format\", \"json\", \"--agent\", agent"] ,
      "commitSha": "75adabe",
      "explanation": "The built-in host selects opencode as its default command and launches `opencode run` for every sibling invocation. The orchestrator API is abstract, but this is the only concrete host implementation shipped in the package, so callers following the obvious path create child OpenCode sessions.",
      "impact": "Execution is coupled to OpenCode process/session semantics, adds latency and nested-agent behavior, and contradicts a direct skill-runtime interpretation of the orchestrator.",
      "remediationSketch": "Remove the CLI host from the default execution path. Make the public runtime require an explicit SkillExecutor registry, and retain any subprocess adapter only as an opt-in compatibility adapter with a non-OpenCode name and no default command.",
      "fixActions": [],
      "verification": null,
      "challenges": [{ "challengeId": "challenge-f001", "challenger": "agent-host-trace", "verdict": "agree", "rationale": "The process launch is directly visible in cli-host.mjs and is reached through host.invokeSiblingSkill; the core orchestrator does not itself launch the process.", "redacted": true }],
      "dissents": [],
      "status": "upheld",
      "statusNote": "Independent host-path tracing confirmed the finding; the distinction between abstract core and shipped default adapter is material.",
      "corroborators": ["agent-host-trace", "agent-runtime-alternatives"],
      "sortKey": "3:2:2:F-002"
    },
    {
      "id": "F-001",
      "title": "The orchestrator has no executable registry for most declared sibling skills",
      "dimension": "correctness",
      "category": "unimplemented-execution-boundary",
      "anchorRef": "ISO/IEC 25010:2023 functional suitability",
      "severity": "high",
      "confidence": "high",
      "evidenceClass": "E2",
      "locations": [{ "path": "csm-orchestrate/capabilities.json", "line": 5, "symbol": "skills" }, { "path": "csm-orchestrate/lib/capabilities.mjs", "line": 28, "symbol": "loadCapabilities" }, { "path": "csm-orchestrate/index.mjs", "line": 1, "symbol": "exports" }],
      "quotedSnippets": ["\"skill\": \"csm-build\"", "entrypoint", "export { createOrchestrator, orchestrate, runOrchestration }"] ,
      "commitSha": "75adabe",
      "explanation": "The manifest describes skill metadata and the public module exports orchestration functions, but no runtime handler map exists for declared sibling skills. The host contract therefore delegates execution to an external implementation, and the repository cannot autonomously run the declared route graph by itself.",
      "impact": "A caller can receive a policy-compliant orchestration engine that blocks without a host or launches another agent, but cannot obtain the intended end-to-end orchestration from this repository alone.",
      "remediationSketch": "Add a versioned executable registry separate from capability metadata. Each supported skill must expose a typed handler with input validation, cancellation, artifact ownership, and typed child-result normalization; unsupported instruction-only skills must be rejected explicitly rather than routed to an implicit LLM session.",
      "fixActions": [],
      "verification": null,
      "challenges": [{ "challengeId": "challenge-f002", "challenger": "agent-runtime-alternatives", "verdict": "agree", "rationale": "Inspection found direct callable pipelines only for a subset such as csm-ddd and csm-scan; no general sibling dispatcher or handler registry is present.", "redacted": true }],
      "dissents": [],
      "status": "upheld",
      "statusNote": "The manifest is correctly metadata-only, but the missing execution plane prevents the stated autonomous outcome.",
      "corroborators": ["agent-goal-inspection", "agent-runtime-alternatives"],
      "sortKey": "3:2:2:F-001"
    },
    {
      "id": "F-003",
      "title": "Final review is not supplied by the built-in CLI host",
      "dimension": "correctness",
      "category": "incomplete-review-boundary",
      "anchorRef": "ISO/IEC 25010:2023 functional suitability",
      "severity": "medium",
      "confidence": "high",
      "evidenceClass": "E2",
      "locations": [{ "path": "csm-orchestrate/lib/cli-host.mjs", "line": 67, "symbol": "createCliHost" }, { "path": "csm-orchestrate/lib/index.mjs", "line": 1184, "symbol": "finalReview" }],
      "quotedSnippets": ["return Object.freeze({", "if (!finalReview && typeof host.invokeReview !== \"function\")"] ,
      "commitSha": "75adabe",
      "explanation": "The built-in CLI host implements invokeSiblingSkill but not invokeReview. A caller using it without an injected finalReview callback reaches the explicit review-required path after sibling execution.",
      "impact": "The advertised autonomous loop is incomplete even when child execution succeeds; the caller must provide a second hidden runtime boundary or stop before terminal verification.",
      "remediationSketch": "Make final review another explicit typed registry capability with an independent reviewer identity, or make the intended review executor part of the same in-process runtime while preserving independent provenance checks.",
      "fixActions": [],
      "verification": null,
      "challenges": [{ "challengeId": "challenge-f003", "challenger": "agent-host-trace", "verdict": "agree", "rationale": "The CLI host object has only invokeSiblingSkill, while index.mjs requires finalReview or host.invokeReview for the final-review boundary.", "redacted": true }],
      "dissents": [],
      "status": "upheld",
      "statusNote": "The behavior is fail-closed, but it is still an incomplete default execution path.",
      "corroborators": ["agent-host-trace"],
      "sortKey": "2:2:2:F-003"
    },
    {
      "id": "F-004",
      "title": "The implementation documents a host contract but does not prove production execution semantics",
      "dimension": "operability",
      "category": "test-boundary-gap",
      "anchorRef": "ISO/IEC 25010:2023 reliability",
      "severity": "medium",
      "confidence": "medium",
      "evidenceClass": "E3",
      "locations": [{ "path": "csm-orchestrate/SKILL.md", "line": 53, "symbol": "host contract" }, { "path": "tests/orchestrate-invocation-approval.test.mjs", "line": 45, "symbol": "fixture host" }],
      "quotedSnippets": ["this repository does not provide live host dispatch", "invokeSiblingSkill"] ,
      "commitSha": "75adabe",
      "explanation": "The documentation explicitly says live host dispatch is absent, and tests use synthetic injected host objects. The suite therefore verifies orchestration policy around a boundary, not that the intended sibling skills can execute through a supported runtime.",
      "impact": "Green tests can mask the central product gap: the control plane is validated, while the execution plane remains caller-supplied and untested as an integrated capability.",
      "remediationSketch": "Add an in-process integration fixture backed by a real executable registry and test complete route execution, cancellation, artifact lineage, review independence, and durable restart without OpenCode or another agent CLI.",
      "fixActions": [],
      "verification": null,
      "challenges": [],
      "dissents": [],
      "status": "upheld",
      "statusNote": "E3 because the gap is directly documented and statically evidenced, but no production caller was evaluated.",
      "corroborators": [],
      "sortKey": "2:1:1:F-004"
    }
  ],
  "verificationStatus": { "format": "csm-verification-status/1", "status": "INCOMPLETE", "unresolved": ["The external OpenCode CLI implementation was not modified or executed; findings concern repository architecture at the pinned commit."] },
  "redaction": { "status": "passed", "rules": ["No credentials, personal data, or absolute paths", "Snippets limited to repository source"], "redactedFields": 0 },
  "sortOrder": { "algorithm": "severity:confidence:evidenceClass:id", "stable": true },
  "ownership": { "owner": "csm-review", "runId": "run-20260830t120000z-orchestrate-review", "collisionPolicy": "reject-owner-mismatch-or-terminal", "terminalPolicy": "immutable" },
  "projection": { "authority": "json", "formats": ["markdown", "html"] }
}
